{
  "schema_version": "2.0",
  "id": "wardrobe-jewelry-base",
  "version": "2.0.0",
  "library": "jewelry",
  "domain": "wardrobe",
  "category": "jewelry",
  "language": "en",
  "status": "active",
  "safety": "general",
  "tags": [
    "base"
  ],
  "fallback_option_id": "wardrobe-jewelry-base-small-hoop-earrings-matte-finish",
  "options": [
    {
      "id": "wardrobe-jewelry-base-small-hoop-earrings-matte-finish",
      "semantic_key": "wardrobe-jewelry-base-small-hoop-earrings-matte-finish",
      "text": "small hoop earrings with a matte finish",
      "sentence": "Small hoop earrings with a matte finish.",
      "variants": [
        {
          "id": "plain",
          "text": "small hoop earrings with a matte finish",
          "weight": 1.0
        },
        {
          "id": "observed",
          "text": "showing small hoop earrings with a matte finish",
          "weight": 0.8
        },
        {
          "id": "rendered",
          "text": "rendered with small hoop earrings with a matte finish",
          "weight": 0.6
        }
      ],
      "weight": 1.0,
      "status": "active",
      "family": "wardrobe-jewelry-base-small-hoop-earrings",
      "tags": [
        "base",
        "jewelry",
        "rarity-common",
        "wardrobe"
      ],
      "facets": {
        "jewelry": "small-hoop-earrings",
        "treatment": "matte-finish"
      },
      "subcategory": "small-hoop-earrings",
      "intensity": "subtle",
      "safety": "general",
      "join_hint": "sentence"
    },
    {
      "id": "wardrobe-jewelry-base-small-hoop-earrings-soft-sheen",
      "semantic_key": "wardrobe-jewelry-base-small-hoop-earrings-soft-sheen",
      "text": "small hoop earrings with a soft sheen",
      "sentence": "Small hoop earrings with a soft sheen.",
      "variants": [
        {
          "id": "plain",
          "text": "small hoop earrings with a soft sheen",
          "weight": 1.0
        },
        {
          "id": "observed",
          "text": "showing small hoop earrings with a soft sheen",
          "weight": 0.8
        },
        {
          "id": "rendered",
          "text": "rendered with small hoop earrings with a soft sheen",
          "weight": 0.6
        }
      ],
      "weight": 1.0,
      "status": "active",
      "family": "wardrobe-jewelry-base-small-hoop-earrings",
      "tags": [
        "base",
        "jewelry",
        "rarity-common",
        "wardrobe"
      ],
      "facets": {
        "jewelry": "small-hoop-earrings",
        "treatment": "soft-sheen"
      },
      "subcategory": "small-hoop-earrings",
      "intensity": "subtle",
      "safety": "general",
      "join_hint": "sentence"
    },
    {
      "id": "wardrobe-jewelry-base-small-hoop-earrings-natural-luster",
      "semantic_key": "wardrobe-jewelry-base-small-hoop-earrings-natural-luster",
      "text": "small hoop earrings with a natural luster",
      "sentence": "Small hoop earrings with a natural luster.",
      "variants": [
        {
          "id": "plain",
          "text": "small hoop earrings with a natural luster",
          "weight": 1.0
        },
        {
          "id": "observed",
          "text": "showing small hoop earrings with a natural luster",
          "weight": 0.8
        },
        {
          "id": "rendered",
          "text": "rendered with small hoop earrings with a natural luster",
          "weight": 0.6
        }
      ],
      "weight": 1.0,
      "status": "active",
      "family": "wardrobe-jewelry-base-small-hoop-earrings",
      "tags": [
        "base",
        "jewelry",
        "rarity-common",
        "wardrobe"
      ],
      "facets": {
        "jewelry": "small-hoop-earrings",
        "treatment": "natural-luster"
      },
      "subcategory": "small-hoop-earrings",
      "intensity": "moderate",
      "safety": "general",
      "join_hint": "sentence"
    },
    {
      "id": "wardrobe-jewelry-base-small-hoop-earrings-textured-finish",
      "semantic_key": "wardrobe-jewelry-base-small-hoop-earrings-textured-finish",
      "text": "small hoop earrings with a textured finish",
      "sentence": "Small hoop earrings with a textured finish.",
      "variants": [
        {
          "id": "plain",
          "text": "small hoop earrings with a textured finish",
          "weight": 1.0
        },
        {
          "id": "observed",
          "text": "showing small hoop earrings with a textured finish",
          "weight": 0.8
        },
        {
          "id": "rendered",
          "text": "rendered with small hoop earrings with a textured finish",
          "weight": 0.6
        }
      ],
      "weight": 1.0,
      "status": "active",
      "family": "wardrobe-jewelry-base-small-hoop-earrings",
      "tags": [
        "base",
        "jewelry",
        "rarity-common",
        "wardrobe"
      ],
      "facets": {
        "jewelry": "small-hoop-earrings",
        "treatment": "textured-finish"
      },
      "subcategory": "small-hoop-earrings",
      "intensity": "moderate",
      "safety": "general",
      "join_hint": "sentence"
    },
    {
      "id": "wardrobe-jewelry-base-small-hoop-earrings-brushed-finish",
      "semantic_key": "wardrobe-jewelry-base-small-hoop-earrings-brushed-finish",
      "text": "small hoop earrings with a brushed finish",
      "sentence": "Small hoop earrings with a brushed finish.",
      "variants": [
        {
          "id": "plain",
          "text": "small hoop earrings with a brushed finish",
          "weight": 1.0
        },
        {
          "id": "observed",
          "text": "showing small hoop earrings with a brushed finish",
          "weight": 0.8
        },
        {
          "id": "rendered",
          "text": "rendered with small hoop earrings with a brushed finish",
          "weight": 0.6
        }
      ],
      "weight": 0.7,
      "status": "active",
      "family": "wardrobe-jewelry-base-small-hoop-earrings",
      "tags": [
        "base",
        "jewelry",
        "rarity-uncommon",
        "wardrobe"
      ],
      "facets": {
        "jewelry": "small-hoop-earrings",
        "treatment": "brushed-finish"
      },
      "subcategory": "small-hoop-earrings",
      "intensity": "moderate",
      "safety": "general",
      "join_hint": "sentence"
    },
    {
      "id": "wardrobe-jewelry-base-small-hoop-earrings-polished-finish",
      "semantic_key": "wardrobe-jewelry-base-small-hoop-earrings-polished-finish",
      "text": "small hoop earrings with a polished finish",
      "sentence": "Small hoop earrings with a polished finish.",
      "variants": [
        {
          "id": "plain",
          "text": "small hoop earrings with a polished finish",
          "weight": 1.0
        },
        {
          "id": "observed",
          "text": "showing small hoop earrings with a polished finish",
          "weight": 0.8
        },
        {
          "id": "rendered",
          "text": "rendered with small hoop earrings with a polished finish",
          "weight": 0.6
        }
      ],
      "weight": 0.7,
      "status": "active",
      "family": "wardrobe-jewelry-base-small-hoop-earrings",
      "tags": [
        "base",
        "jewelry",
        "rarity-uncommon",
        "wardrobe"
      ],
      "facets": {
        "jewelry": "small-hoop-earrings",
        "treatment": "polished-finish"
      },
      "subcategory": "small-hoop-earrings",
      "intensity": "moderate",
      "safety": "general",
      "join_hint": "sentence"
    },
    {
      "id": "wardrobe-jewelry-base-small-hoop-earrings-weathered-finish",
      "semantic_key": "wardrobe-jewelry-base-small-hoop-earrings-weathered-finish",
      "text": "small hoop earrings with a weathered finish",
      "sentence": "Small hoop earrings with a weathered finish.",
      "variants": [
        {
          "id": "plain",
          "text": "small hoop earrings with a weathered finish",
          "weight": 1.0
        },
        {
          "id": "observed",
          "text": "showing small hoop earrings with a weathered finish",
          "weight": 0.8
        },
        {
          "id": "rendered",
          "text": "rendered with small hoop earrings with a weathered finish",
          "weight": 0.6
        }
      ],
      "weight": 0.4,
      "status": "active",
      "family": "wardrobe-jewelry-base-small-hoop-earrings",
      "tags": [
        "base",
        "jewelry",
        "rarity-rare",
        "wardrobe"
      ],
      "facets": {
        "jewelry": "small-hoop-earrings",
        "treatment": "weathered-finish"
      },
      "subcategory": "small-hoop-earrings",
      "intensity": "strong",
      "safety": "general",
      "join_hint": "sentence"
    },
    {
      "id": "wardrobe-jewelry-base-small-hoop-earrings-satin-finish",
      "semantic_key": "wardrobe-jewelry-base-small-hoop-earrings-satin-finish",
      "text": "small hoop earrings with a satin finish",
      "sentence": "Small hoop earrings with a satin finish.",
      "variants": [
        {
          "id": "plain",
          "text": "small hoop earrings with a satin finish",
          "weight": 1.0
        },
        {
          "id": "observed",
          "text": "showing small hoop earrings with a satin finish",
          "weight": 0.8
        },
        {
          "id": "rendered",
          "text": "rendered with small hoop earrings with a satin finish",
          "weight": 0.6
        }
      ],
      "weight": 0.4,
      "status": "active",
      "family": "wardrobe-jewelry-base-small-hoop-earrings",
      "tags": [
        "base",
        "jewelry",
        "rarity-rare",
        "wardrobe"
      ],
      "facets": {
        "jewelry": "small-hoop-earrings",
        "treatment": "satin-finish"
      },
      "subcategory": "small-hoop-earrings",
      "intensity": "strong",
      "safety": "general",
      "join_hint": "sentence"
    },
    {
      "id": "wardrobe-jewelry-base-drop-earrings-matte-finish",